{"binding":{"execution_attempt_id":"attempt","key_id":"key","max_encoded_tokens":20,"max_question_rows":2,"policy_revision":"policy","request_id":"request","request_sha256":"bbbbbbbbbbbbbbbbbbbbbbbbbbbbbbbbbbbbbbbbbbbbbbbbbbbbbbbbbbbbbbbb","reservation_id":"reservation","runtime":{"backend":"cpu-reference","checkpoint_revision":"aaaaaaaaaaaaaaaaaaaaaaaaaaaaaaaaaaaaaaaa","model":"laya-english","runtime_generation":"generation","runtime_revision":"fixture-build"},"tenant_id":"tenant","usage_event_id":"usage"},"deadline_unix_ms":3000,"prepared_encoded_tokens":17,"prepared_question_rows":2}
